{
  "$schema": "https://json-schema.org/draft/2020-12/schema",
  "$id": "https://github.com/davidahmann/production-agent-engineering/schemas/operational-ontology.schema.json",
  "title": "Operational ontology",
  "type": "object",
  "additionalProperties": false,
  "required": ["$schema", "schema_version", "ontology_id", "version", "domain", "owners", "entities", "relationships", "actions", "policies", "invariants", "evidence_types"],
  "properties": {
    "$schema": { "type": "string" },
    "schema_version": { "const": "1.0.0" },
    "ontology_id": { "$ref": "#/$defs/id" },
    "version": { "$ref": "#/$defs/version" },
    "domain": { "type": "string", "minLength": 2 },
    "owners": {
      "type": "array",
      "minItems": 1,
      "uniqueItems": true,
      "items": { "type": "string", "minLength": 2 }
    },
    "entities": {
      "type": "array",
      "minItems": 1,
      "items": {
        "type": "object",
        "additionalProperties": false,
        "required": ["entity_id", "source_of_truth", "identity_keys", "attributes", "lifecycle_states"],
        "properties": {
          "entity_id": { "$ref": "#/$defs/id" },
          "source_of_truth": { "type": "string", "minLength": 2 },
          "identity_keys": {
            "type": "array",
            "minItems": 1,
            "uniqueItems": true,
            "items": { "$ref": "#/$defs/id" }
          },
          "attributes": {
            "type": "array",
            "minItems": 1,
            "items": {
              "type": "object",
              "additionalProperties": false,
              "required": ["name", "type", "required", "classification", "temporal"],
              "properties": {
                "name": { "$ref": "#/$defs/id" },
                "type": { "enum": ["boolean", "date", "datetime", "decimal", "integer", "object", "string"] },
                "required": { "type": "boolean" },
                "classification": { "enum": ["public", "internal", "confidential", "restricted"] },
                "temporal": { "type": "boolean" }
              }
            }
          },
          "lifecycle_states": {
            "type": "array",
            "minItems": 1,
            "uniqueItems": true,
            "items": { "$ref": "#/$defs/id" }
          }
        }
      }
    },
    "relationships": {
      "type": "array",
      "items": {
        "type": "object",
        "additionalProperties": false,
        "required": ["relationship_id", "from", "to", "cardinality", "source_of_truth"],
        "properties": {
          "relationship_id": { "$ref": "#/$defs/id" },
          "from": { "$ref": "#/$defs/id" },
          "to": { "$ref": "#/$defs/id" },
          "cardinality": { "enum": ["one_to_one", "one_to_many", "many_to_one", "many_to_many"] },
          "source_of_truth": { "type": "string", "minLength": 2 }
        }
      }
    },
    "actions": {
      "type": "array",
      "minItems": 1,
      "items": {
        "type": "object",
        "additionalProperties": false,
        "required": ["action_id", "actor_types", "input_entities", "output_entities", "preconditions", "postconditions", "authorization_policy", "side_effect", "idempotency_scope"],
        "properties": {
          "action_id": { "$ref": "#/$defs/id" },
          "actor_types": { "$ref": "#/$defs/nonEmptyIds" },
          "input_entities": { "$ref": "#/$defs/nonEmptyIds" },
          "output_entities": { "$ref": "#/$defs/nonEmptyIds" },
          "preconditions": { "$ref": "#/$defs/nonEmptyStrings" },
          "postconditions": { "$ref": "#/$defs/nonEmptyStrings" },
          "authorization_policy": { "$ref": "#/$defs/id" },
          "side_effect": { "enum": ["none", "staged", "reversible", "irreversible"] },
          "idempotency_scope": { "type": ["string", "null"] }
        }
      }
    },
    "policies": {
      "type": "array",
      "minItems": 1,
      "items": {
        "type": "object",
        "additionalProperties": false,
        "required": ["policy_id", "decision", "inputs", "enforcement_point", "fail_mode"],
        "properties": {
          "policy_id": { "$ref": "#/$defs/id" },
          "decision": { "enum": ["allow", "deny", "allow_with_obligations"] },
          "inputs": { "$ref": "#/$defs/nonEmptyIds" },
          "enforcement_point": { "type": "string", "minLength": 2 },
          "fail_mode": { "const": "closed" }
        }
      }
    },
    "invariants": {
      "type": "array",
      "minItems": 1,
      "items": {
        "type": "object",
        "additionalProperties": false,
        "required": ["invariant_id", "expression", "enforcement", "severity"],
        "properties": {
          "invariant_id": { "$ref": "#/$defs/id" },
          "expression": { "type": "string", "minLength": 5 },
          "enforcement": { "type": "string", "minLength": 2 },
          "severity": { "enum": ["low", "medium", "high", "critical"] }
        }
      }
    },
    "evidence_types": {
      "type": "array",
      "minItems": 1,
      "items": {
        "type": "object",
        "additionalProperties": false,
        "required": ["evidence_id", "source", "freshness_slo_seconds", "classification"],
        "properties": {
          "evidence_id": { "$ref": "#/$defs/id" },
          "source": { "type": "string", "minLength": 2 },
          "freshness_slo_seconds": { "type": "integer", "minimum": 0 },
          "classification": { "enum": ["public", "internal", "confidential", "restricted"] }
        }
      }
    }
  },
  "$defs": {
    "id": { "type": "string", "pattern": "^[a-z][a-z0-9_-]*$" },
    "version": { "type": "string", "pattern": "^[0-9]+\\.[0-9]+\\.[0-9]+$" },
    "nonEmptyIds": {
      "type": "array",
      "minItems": 1,
      "uniqueItems": true,
      "items": { "$ref": "#/$defs/id" }
    },
    "nonEmptyStrings": {
      "type": "array",
      "minItems": 1,
      "items": { "type": "string", "minLength": 3 }
    }
  }
}
