{
  "$schema": "../../schemas/operational-ontology.schema.json",
  "schema_version": "1.0.0",
  "ontology_id": "invoice_exception",
  "version": "1.0.0",
  "domain": "accounts payable invoice exceptions",
  "owners": ["accounts-payable-operations", "finance-data-platform"],
  "entities": [
    {
      "entity_id": "invoice",
      "source_of_truth": "accounts-payable-ledger",
      "identity_keys": ["tenant_id", "invoice_id"],
      "attributes": [
        { "name": "tenant_id", "type": "string", "required": true, "classification": "confidential", "temporal": false },
        { "name": "invoice_id", "type": "string", "required": true, "classification": "confidential", "temporal": false },
        { "name": "amount", "type": "decimal", "required": true, "classification": "confidential", "temporal": true },
        { "name": "status", "type": "string", "required": true, "classification": "confidential", "temporal": true },
        { "name": "revision", "type": "string", "required": true, "classification": "internal", "temporal": true }
      ],
      "lifecycle_states": ["received", "matched", "exception", "resolution_staged", "resolved"]
    },
    {
      "entity_id": "vendor",
      "source_of_truth": "vendor-master",
      "identity_keys": ["tenant_id", "vendor_id"],
      "attributes": [
        { "name": "tenant_id", "type": "string", "required": true, "classification": "confidential", "temporal": false },
        { "name": "vendor_id", "type": "string", "required": true, "classification": "confidential", "temporal": false },
        { "name": "risk_status", "type": "string", "required": true, "classification": "restricted", "temporal": true }
      ],
      "lifecycle_states": ["active", "on_hold", "blocked"]
    },
    {
      "entity_id": "approval_policy",
      "source_of_truth": "finance-policy-service",
      "identity_keys": ["tenant_id", "policy_id", "revision"],
      "attributes": [
        { "name": "tenant_id", "type": "string", "required": true, "classification": "confidential", "temporal": false },
        { "name": "policy_id", "type": "string", "required": true, "classification": "internal", "temporal": false },
        { "name": "revision", "type": "string", "required": true, "classification": "internal", "temporal": true },
        { "name": "effective_at", "type": "datetime", "required": true, "classification": "internal", "temporal": true }
      ],
      "lifecycle_states": ["draft", "active", "superseded"]
    },
    {
      "entity_id": "resolution_proposal",
      "source_of_truth": "agent-workflow-store",
      "identity_keys": ["tenant_id", "proposal_id"],
      "attributes": [
        { "name": "tenant_id", "type": "string", "required": true, "classification": "confidential", "temporal": false },
        { "name": "proposal_id", "type": "string", "required": true, "classification": "confidential", "temporal": false },
        { "name": "proposal_digest", "type": "string", "required": true, "classification": "internal", "temporal": false },
        { "name": "action", "type": "string", "required": true, "classification": "confidential", "temporal": false }
      ],
      "lifecycle_states": ["staged", "approved", "rejected", "expired", "committed", "discarded"]
    }
  ],
  "relationships": [
    { "relationship_id": "invoice_vendor", "from": "invoice", "to": "vendor", "cardinality": "many_to_one", "source_of_truth": "accounts-payable-ledger" },
    { "relationship_id": "invoice_resolution", "from": "invoice", "to": "resolution_proposal", "cardinality": "one_to_many", "source_of_truth": "agent-workflow-store" }
  ],
  "actions": [
    {
      "action_id": "stage_resolution",
      "actor_types": ["agent"],
      "input_entities": ["invoice", "vendor", "approval_policy"],
      "output_entities": ["resolution_proposal"],
      "preconditions": ["invoice.status == exception", "vendor.risk_status != blocked", "approval_policy.lifecycle_state == active"],
      "postconditions": ["resolution_proposal.lifecycle_state == staged"],
      "authorization_policy": "resolution_stage_policy",
      "side_effect": "staged",
      "idempotency_scope": "tenant_id + invoice_id + invoice.revision"
    },
    {
      "action_id": "commit_resolution",
      "actor_types": ["agent", "ap_approver"],
      "input_entities": ["invoice", "resolution_proposal", "approval_policy"],
      "output_entities": ["invoice"],
      "preconditions": ["resolution_proposal.lifecycle_state == approved", "approval.proposal_digest == resolution_proposal.proposal_digest"],
      "postconditions": ["invoice.status == resolved", "resolution_commits(tenant_id, invoice_id, invoice.revision, commit_resolution) == 1"],
      "authorization_policy": "resolution_commit_policy",
      "side_effect": "reversible",
      "idempotency_scope": "tenant_id + invoice_id + invoice.revision + action"
    }
  ],
  "policies": [
    {
      "policy_id": "resolution_stage_policy",
      "decision": "allow_with_obligations",
      "inputs": ["agent_identity", "caller_identity", "invoice", "approval_policy"],
      "enforcement_point": "tool-gateway",
      "fail_mode": "closed"
    },
    {
      "policy_id": "resolution_commit_policy",
      "decision": "allow_with_obligations",
      "inputs": ["agent_identity", "caller_identity", "invoice", "resolution_proposal", "approval_policy"],
      "enforcement_point": "commit-service",
      "fail_mode": "closed"
    }
  ],
  "invariants": [
    { "invariant_id": "single_resolution", "expression": "resolution_commits(tenant_id, invoice_id, invoice.revision, commit_resolution) <= 1", "enforcement": "accounts-payable-ledger", "severity": "critical" },
    { "invariant_id": "tenant_isolation", "expression": "caller.tenant_id == invoice.tenant_id", "enforcement": "tool-gateway", "severity": "critical" },
    { "invariant_id": "approval_binding", "expression": "commit.proposal_digest == approval.proposal_digest", "enforcement": "commit-service", "severity": "critical" }
  ],
  "evidence_types": [
    { "evidence_id": "invoice_snapshot", "source": "accounts-payable-ledger", "freshness_slo_seconds": 60, "classification": "confidential" },
    { "evidence_id": "vendor_snapshot", "source": "vendor-master", "freshness_slo_seconds": 300, "classification": "restricted" },
    { "evidence_id": "policy_snapshot", "source": "finance-policy-service", "freshness_slo_seconds": 60, "classification": "internal" }
  ]
}
